{"grao":"1 linha por semana (últimas 52) × grupo × departamento","dimensoes":{"semana_inicio":["2016-12-07","2016-12-14","2016-12-21","2016-12-28","2017-01-04","2017-01-11","2017-01-18","2017-01-25","2017-02-01","2017-02-08","2017-02-15","2017-02-22","2017-03-01","2017-03-08","2017-03-15","2017-03-22","2017-03-29","2017-04-05","2017-04-12","2017-04-19","2017-04-26","2017-05-03","2017-05-10","2017-05-17","2017-05-24","2017-05-31","2017-06-07","2017-06-14","2017-06-21","2017-06-28","2017-07-05","2017-07-12","2017-07-19","2017-07-26","2017-08-02","2017-08-09","2017-08-16","2017-08-23","2017-08-30","2017-09-06","2017-09-13","2017-09-20","2017-09-27","2017-10-04","2017-10-11","2017-10-18","2017-10-25","2017-11-01","2017-11-08","2017-11-15","2017-11-22","2017-11-29"],"grupo":["Fiéis","Regulares","Esporádicos","Em pausa","Sem segmento"],"departamento":["CHEF SHOPPE","COSMETICS","DELI","DRUG GM","FLORAL","FROZEN GROCERY","GROCERY","MEAT","MEAT-PCKGD","NUTRITION","PASTRY","PRODUCE","RESTAURANT","SALAD BAR","SEAFOOD","SEAFOOD-PCKGD","SPIRITS","TRAVEL & LEISUR","AUTOMOTIVE","GARDEN CENTER","PHOTO","VIDEO RENTAL","TOYS","DELI/SNACK BAR","HOUSEWARES","PROD-WHS SALES","PORK","POSTAL CENTER","GM MERCH EXP","HBC","DAIRY DELI","RX","ELECT &PLUMBING","CHARITABLE CONT","MEAT-WHSE","VIDEO"]},"colunas":["semana_inicio","grupo","departamento","faturamento","faturamento_ano_anterior"],"linhas":[[0,0,0,2.99,null],[0,0,1,234.24,null],[0,0,2,1711.45,null],[0,0,3,6907.74,null],[0,0,4,251.67,null],[0,0,5,11.99,null],[0,0,6,28323.49,null],[0,0,7,3725.29,null],[0,0,8,2733.28,null],[0,0,9,965.96,null],[0,0,10,752.94,null],[0,0,11,4097.56,null],[0,0,12,14.39,null],[0,0,13,218.01,null],[0,0,14,280.42,null],[0,0,15,827.6,null],[0,0,16,78.69,null],[0,0,17,6.83,null],[0,1,18,7.19,null],[0,1,0,2.99,null],[0,1,1,78.34,null],[0,1,2,820.46,null],[0,1,3,3348.28,null],[0,1,4,69.41,null],[0,1,6,14660.35,null],[0,1,7,1991.85,null],[0,1,8,1436.39,null],[0,1,9,335.54,null],[0,1,10,450.35,null],[0,1,11,1932.86,null],[0,1,12,3.5,null],[0,1,13,95.19,null],[0,1,14,96.53,null],[0,1,15,375.46,null],[0,1,16,30.47,null],[0,1,17,7.72,null],[0,2,1,5.49,null],[0,2,2,139.36,null],[0,2,3,532.22,null],[0,2,4,20.98,null],[0,2,6,1994.02,null],[0,2,7,190.12,null],[0,2,8,172.17,null],[0,2,9,75.27,null],[0,2,10,29.68,null],[0,2,11,278.17,null],[0,2,13,8.63,null],[0,2,14,11.99,null],[0,2,15,50.39,null],[0,2,16,20.48,null],[0,3,1,11.83,null],[0,3,2,13.63,null],[0,3,3,293.73,null],[0,3,6,970.45,null],[0,3,7,179.07,null],[0,3,8,147.38,null],[0,3,9,6.76,null],[0,3,10,18.28,null],[0,3,11,79.73,null],[0,3,14,2.98,null],[0,3,15,45.96,null],[0,4,1,1.99,null],[0,4,2,22.77,null],[0,4,3,126.89,null],[0,4,6,286.74,null],[0,4,7,71.51,null],[0,4,8,20.87,null],[0,4,9,16.66,null],[0,4,10,11.76,null],[0,4,11,32.47,null],[0,4,15,15.73,null],[0,4,16,13.48,null],[1,0,0,4.48,null],[1,0,1,201.21,null],[1,0,2,1622.27,null],[1,0,3,7669.92,null],[1,0,4,243.28,null],[1,0,5,2.47,null],[1,0,6,27839.13,null],[1,0,7,3553.28,null],[1,0,8,3068.57,null],[1,0,9,651.99,null],[1,0,10,604.06,null],[1,0,11,3874.96,null],[1,0,12,14.06,null],[1,0,13,225.81,null],[1,0,14,298.16,null],[1,0,15,578.55,null],[1,0,16,111.47,null],[1,0,17,7.03,null],[1,1,18,7.19,null],[1,1,0,4.98,null],[1,1,1,55.29,null],[1,1,2,725.42,null],[1,1,3,2503.54,null],[1,1,4,73.64,null],[1,1,6,12057.08,null],[1,1,7,1608.69,null],[1,1,8,1429.24,null],[1,1,9,279.42,null],[1,1,10,373.9,null],[1,1,11,1556.38,null],[1,1,12,9.35,null],[1,1,13,118.71,null],[1,1,14,68.21,null],[1,1,15,269.08,null],[1,1,16,34.45,null],[1,1,17,3.17,null],[1,2,1,13.76,null],[1,2,2,104.15,null],[1,2,3,652.4,null],[1,2,6,2083.72,null],[1,2,7,287.99,null],[1,2,8,255.21,null],[1,2,9,17.57,null],[1,2,10,39.69,null],[1,2,11,266.6,null],[1,2,13,37.81,null],[1,2,14,11.34,null],[1,2,15,48.79,null],[1,2,16,17.99,null],[1,3,2,85.88,null],[1,3,3,72.92,null],[1,3,6,597.72,null],[1,3,7,106.18,null],[1,3,8,97.45,null],[1,3,9,7.08,null],[1,3,10,13.49,null],[1,3,11,82.75,null],[1,3,13,18.23,null],[1,3,16,8.28,null],[1,4,2,14.85,null],[1,4,3,53.88,null],[1,4,6,195.75,null],[1,4,7,24.71,null],[1,4,8,9.98,null],[1,4,9,25.93,null],[1,4,10,18.97,null],[1,4,11,35.61,null],[1,4,14,10.67,null],[1,4,16,3.99,null],[2,0,18,8.99,null],[2,0,0,2.99,null],[2,0,1,212.85,null],[2,0,2,1682.12,null],[2,0,3,7129.0,null],[2,0,4,289.0,null],[2,0,5,11.21,null],[2,0,19,431.77,null],[2,0,6,29059.6,null],[2,0,7,3422.51,null],[2,0,8,2223.23,null],[2,0,9,896.0,null],[2,0,10,877.58,null],[2,0,20,6.38,null],[2,0,11,3828.38,null],[2,0,12,3.2,null],[2,0,13,308.6,null],[2,0,14,193.13,null],[2,0,15,629.09,null],[2,0,16,154.93,null],[2,0,17,26.24,null],[2,1,1,124.3,null],[2,1,2,584.05,null],[2,1,3,2608.47,null],[2,1,4,108.22,null],[2,1,5,1.0,null],[2,1,19,12.78,null],[2,1,6,12357.37,null],[2,1,7,1495.82,null],[2,1,8,953.79,null],[2,1,9,318.68,null],[2,1,10,421.65,null],[2,1,11,1492.84,null],[2,1,12,7.16,null],[2,1,13,118.46,null],[2,1,14,51.7,null],[2,1,15,280.26,null],[2,1,16,47.96,null],[2,2,1,0.99,null],[2,2,2,223.56,null],[2,2,3,439.76,null],[2,2,4,3.97,null],[2,2,6,1976.22,null],[2,2,7,272.09,null],[2,2,8,220.15,null],[2,2,9,21.57,null],[2,2,10,63.08,null],[2,2,11,201.13,null],[2,2,13,14.13,null],[2,2,15,7.88,null],[2,2,16,52.94,null],[2,2,17,3.23,null],[2,3,2,24.96,null],[2,3,3,222.43,null],[2,3,6,691.18,null],[2,3,7,93.17,null],[2,3,8,82.21,null],[2,3,9,15.37,null],[2,3,10,4.16,null],[2,3,11,93.48,null],[2,3,13,10.74,null],[2,3,14,25.24,null],[2,3,15,13.98,null],[2,4,1,7.19,null],[2,4,2,41.68,null],[2,4,3,92.31,null],[2,4,6,440.95,null],[2,4,7,64.38,null],[2,4,8,7.77,null],[2,4,9,32.97,null],[2,4,11,44.18,null],[2,4,13,10.45,null],[2,4,14,4.59,null],[2,4,15,7.98,null],[3,0,1,236.7,null],[3,0,2,1614.58,null],[3,0,3,6465.76,null],[3,0,4,188.49,null],[3,0,5,1.0,null],[3,0,19,4.99,null],[3,0,6,28853.17,null],[3,0,7,3594.7,null],[3,0,8,2552.55,null],[3,0,9,768.44,null],[3,0,10,747.41,null],[3,0,11,3844.22,null],[3,0,12,1.99,null],[3,0,13,158.6,null],[3,0,14,334.26,null],[3,0,15,598.82,null],[3,0,16,103.59,null],[3,0,17,27.18,null],[3,0,21,0.0,null],[3,1,18,0.0,null],[3,1,1,93.54,null],[3,1,2,647.59,null],[3,1,3,3035.94,null],[3,1,4,121.56,null],[3,1,5,4.18,null],[3,1,6,11653.94,null],[3,1,7,1432.3,null],[3,1,8,1242.61,null],[3,1,9,253.02,null],[3,1,10,377.84,null],[3,1,11,1489.65,null],[3,1,12,17.94,null],[3,1,13,60.3,null],[3,1,14,126.65,null],[3,1,15,222.91,null],[3,1,16,120.89,null],[3,1,17,2.02,null],[3,2,1,21.89,null],[3,2,2,121.96,null],[3,2,3,378.37,null],[3,2,4,16.99,null],[3,2,6,1559.88,null],[3,2,7,161.12,null],[3,2,8,121.07,null],[3,2,9,105.57,null],[3,2,10,46.58,null],[3,2,11,124.73,null],[3,2,13,21.6,null],[3,2,14,0.0,null],[3,2,15,28.96,null],[3,3,2,86.83,null],[3,3,3,205.11,null],[3,3,4,18.94,null],[3,3,6,918.93,null],[3,3,7,128.63,null],[3,3,8,122.65,null],[3,3,9,27.1,null],[3,3,10,22.85,null],[3,3,11,140.59,null],[3,3,15,22.01,null],[3,3,16,12.99,null],[3,4,2,3.27,null],[3,4,3,33.58,null],[3,4,6,147.85,null],[3,4,7,11.79,null],[3,4,8,6.49,null],[3,4,9,3.99,null],[3,4,11,11.44,null],[3,4,14,15.28,null],[3,4,16,3.99,null],[4,0,0,4.99,null],[4,0,1,176.6,null],[4,0,2,1724.22,null],[4,0,3,7372.13,null],[4,0,4,318.97,null],[4,0,5,7.11,null],[4,0,19,241.74,null],[4,0,6,28713.1,null],[4,0,7,3886.6,null],[4,0,8,2918.63,null],[4,0,9,888.73,null],[4,0,10,729.74,null],[4,0,11,4242.12,null],[4,0,12,38.65,null],[4,0,13,181.78,null],[4,0,14,260.5,null],[4,0,15,505.11,null],[4,0,16,82.06,null],[4,0,17,10.99,null],[4,1,1,80.55,null],[4,1,2,704.67,null],[4,1,3,3133.09,null],[4,1,4,99.38,null],[4,1,19,25.56,null],[4,1,6,12244.47,null],[4,1,7,1878.15,null],[4,1,8,1319.7,null],[4,1,9,207.76,null],[4,1,10,408.0,null],[4,1,20,4.0,null],[4,1,11,1806.97,null],[4,1,12,21.85,null],[4,1,13,90.63,null],[4,1,14,58.34,null],[4,1,15,231.4,null],[4,1,16,91.03,null],[4,1,17,7.64,null],[4,2,1,17.67,null],[4,2,2,67.95,null],[4,2,3,480.13,null],[4,2,19,8.99,null],[4,2,6,1249.61,null],[4,2,7,153.36,null],[4,2,8,185.39,null],[4,2,9,7.78,null],[4,2,10,56.46,null],[4,2,11,160.03,null],[4,2,13,3.55,null],[4,2,14,10.73,null],[4,2,15,44.99,null],[4,2,16,3.99,null],[4,3,0,0.0,null],[4,3,1,5.98,null],[4,3,2,54.77,null],[4,3,3,287.04,null],[4,3,6,994.24,null],[4,3,7,190.01,null],[4,3,8,129.73,null],[4,3,9,11.57,null],[4,3,10,25.89,null],[4,3,11,98.47,null],[4,3,14,0.0,null],[4,3,15,4.0,null],[4,4,1,3.11,null],[4,4,2,15.53,null],[4,4,3,41.03,null],[4,4,6,244.42,null],[4,4,7,6.42,null],[4,4,8,25.54,null],[4,4,9,3.0,null],[4,4,10,1.5,null],[4,4,11,36.29,null],[4,4,13,11.58,null],[5,0,18,18.71,null],[5,0,0,7.54,null],[5,0,1,279.64,null],[5,0,2,1806.03,null],[5,0,3,6513.86,null],[5,0,4,242.9,null],[5,0,5,1.63,null],[5,0,19,38.95,null],[5,0,6,28302.53,null],[5,0,7,3976.12,null],[5,0,8,2817.78,null],[5,0,9,746.13,null],[5,0,10,663.6,null],[5,0,20,2.0,null],[5,0,11,4039.43,null],[5,0,12,11.55,null],[5,0,13,175.88,null],[5,0,14,245.78,null],[5,0,15,457.39,null],[5,0,16,84.6,null],[5,0,17,12.81,null],[5,1,18,12.91,null],[5,1,0,0.0,null],[5,1,1,98.67,null],[5,1,2,673.42,null],[5,1,3,3373.75,null],[5,1,4,87.92,null],[5,1,5,0.0,null],[5,1,19,24.0,null],[5,1,6,12805.59,null],[5,1,7,1538.33,null],[5,1,8,1381.11,null],[5,1,9,322.36,null],[5,1,10,355.87,null],[5,1,11,1605.8,null],[5,1,12,7.2,null],[5,1,13,78.29,null],[5,1,14,68.78,null],[5,1,15,254.79,null],[5,1,16,28.23,null],[5,2,0,8.97,null],[5,2,1,1.79,null],[5,2,2,186.32,null],[5,2,3,333.93,null],[5,2,4,11.99,null],[5,2,19,19.99,null],[5,2,6,1845.44,null],[5,2,7,263.45,null],[5,2,8,181.85,null],[5,2,9,34.44,null],[5,2,10,42.44,null],[5,2,11,190.49,null],[5,2,13,28.4,null],[5,2,14,1.09,null],[5,2,15,35.8,null],[5,3,0,0.0,null],[5,3,1,8.54,null],[5,3,2,52.19,null],[5,3,3,167.45,null],[5,3,4,54.97,null],[5,3,6,877.33,null],[5,3,7,134.25,null],[5,3,8,123.8,null],[5,3,9,21.94,null],[5,3,10,50.04,null],[5,3,11,203.22,null],[5,3,13,9.14,null],[5,3,14,0.0,null],[5,3,15,13.95,null],[5,4,2,16.04,null],[5,4,3,57.0,null],[5,4,6,226.38,null],[5,4,7,12.68,null],[5,4,8,1.19,null],[5,4,9,9.47,null],[5,4,10,2.38,null],[5,4,11,2